2020-03-24T09:26:03+08:00,Coronavirus could force many fighters out of boxing  says Hearn,https://news.abs-cbn.com/sports/03/24/20/coronavirus-could-force-many-fighters-out-of-boxing-says-hearn
2020-03-24T09:02:57+08:00,Mga hayop sa mga pet shop sa Cartimar inaalagaan pa rin sa gitna ng COVID-19,https://news.abs-cbn.com/news/03/24/20/mga-hayop-sa-mga-pet-shop-sa-cartimar-inaalagaan-pa-rin-sa-gitna-ng-covid-19
2020-03-24T09:00:19+08:00,As COVID-19 grounds cruise ships  some 10 000 Filipino seafarers need to be repatriated,https://news.abs-cbn.com/news/03/24/20/as-covid-19-grounds-cruise-ships-some-10000-filipino-seafarers-need-to-be-repatriated
2020-03-24T08:56:00+08:00,Trump says unproven coronavirus drugs could be 'gift from God',https://news.abs-cbn.com/overseas/03/24/20/trump-says-unproven-coronavirus-drugs-could-be-gift-from-god
2020-03-24T08:55:54+08:00,Saudi implements dusk-to-dawn curfew over coronavirus,https://news.abs-cbn.com/overseas/03/24/20/saudi-implements-dusk-to-dawn-curfew-over-coronavirus
2020-03-24T08:40:10+08:00,'Biosafety threat' temporarily halted COVID-19 testing: health dept,https://news.abs-cbn.com/video/news/03/24/20/biosafety-threat-temporarily-halted-covid-19-testing-health-dept
2020-03-24T08:34:18+08:00,At Lazada  coronavirus measures become the latest culture conflict,https://news.abs-cbn.com/business/03/24/20/at-lazada-coronavirus-measures-become-the-latest-culture-conflict
2020-03-24T08:28:50+08:00,Testing is key to low fatality rate  says South Korea’s Foreign Minister on battling COVID-19,https://news.abs-cbn.com/ancx/culture/spotlight/03/24/20/testing-is-key-to-low-fatality-rate-says-south-koreas-foreign-minister-on-battling-covid-19
2020-03-24T08:19:35+08:00,COVID-19 cases to spike despite Luzon lockdown due to new test kits: health dept,https://news.abs-cbn.com/news/03/24/20/covid-19-cases-to-spike-despite-luzon-lockdown-due-to-new-test-kits-health-dept
2020-03-24T08:17:22+08:00,Chloroquine allowed by France to treat gravest virus cases: minister,https://news.abs-cbn.com/overseas/03/24/20/chloroquine-allowed-by-france-to-treat-gravest-virus-cases-minister
2020-03-24T07:36:36+08:00,COVID-19 CRISIS: How President Duterte’s emergency powers bill morphed in 36 hours,https://news.abs-cbn.com/news/03/24/20/covid-19-crisis-how-president-dutertes-emergency-powers-bill-morphed-in-36-hours
