March 24 2020  09:27 AM,SHORTAGE | US factories shift to surgical masks to fight virus,https://news.tv5.com.ph/breaking/read/shortage-us-factories-shift-to-surgical-masks-to-fight-virus
March 24 2020  07:51 AM,FULL LOCKDOWN | Johnson orders Britons to stay home to help curb virus spread,https://news.tv5.com.ph/breaking/read/full-lockdown-johnson-orders-britons-to-stay-home-to-help-curb-virus-spread
March 24 2020  02:19 AM,EXTRA POWERS | Congress grants Duterte special powers for COVID-19 fight,https://news.tv5.com.ph/breaking/read/extra-powers-congress-grants-duterte-special-powers-for-covid-19-fight
March 24 2020  12:31 AM,UNDER PRESSURE | Olympics postponement looms as countries beg off over virus,https://news.tv5.com.ph/breaking/read/under-pressure-olympics-postponement-looms-as-countries-beg-off-over-virus
March 23 2020  11:12 PM,COVID TOLL | Medical City workforce &#8216;overstretched&#8217; as 137 workers go on quarantine,https://news.tv5.com.ph/breaking/read/covid-toll-medical-city-workforce-overstretched-as-137-workers-go-on-quarantine
March 23 2020  08:20 PM,FRONTLINE CONCERNS | Medical supply shortage at PGH feared after designation as COVID-19 hospital,https://news.tv5.com.ph/breaking/read/frontline-concerns-medical-supply-shortage-at-pgh-feared-after-designation-as-covid-19-hospital
